title,url,field,source_file,possibly_broken
Deadline Approaching:,https://form.jotform.com/241476651734158,link,extracted_new_stuyvesant_opportunities.json,NO
Camp College,https://www.nysacac.org/camp-college,link,extracted_new_stuyvesant_opportunities.json,NO
Mandatory Information Sessions Approaching: College Explorers Program,https://drive.google.com/file/d/11hitH7iSvpWWs56UR2LbwS84ZoEukM64/view?usp=sharing,link,extracted_new_stuyvesant_opportunities.json,NO
Deadline Approaching:,https://tinyurl.com/fhaa-teen-leadership,link,extracted_new_stuyvesant_opportunities.json,NO
Debate League Summer Camp,https://www.brooklyndebateleague.org/summer-camp,link,extracted_new_stuyvesant_opportunities.json,NO
Queens Public Library Intro to Podcasting for Teens,https://www.queenslibrary.org/calendar/intro-to-podcasting-for-teens/013427-,link,extracted_new_stuyvesant_opportunities.json,NO
Rooted in the City Internship,https://risingeartheducation.org/rooted-in-the-city,link,extracted_new_stuyvesant_opportunities.json,NO
Deadline Approaching: Lucid AI Academy Application,https://www.lucid-education.com/innovators#faqs,link,extracted_new_stuyvesant_opportunities.json,NO
Cyber-AI Investigation Camp,https://spprep.org/2025/05/02/cyber-ai-investigation-camp-at-u-scranton/,link,extracted_new_stuyvesant_opportunities.json,NO
Program Date Approaching:,https://www.mircore.org/2025-summer-camp/,link,extracted_new_stuyvesant_opportunities.json,NO
Ronald V. Dellums Memorial SMART Scholarship,https://www.smartscholarship.org/smart?id=kb_article&sys_id=0383c5d6db2a03006b,link,extracted_new_stuyvesant_opportunities.json,NO
Coursera Free Online Courses,https://dol.ny.gov/online-learning-coursera,link,extracted_new_stuyvesant_opportunities.json,NO
Fordham University Real Estate Institute,https://www.google.com/search?q=Fordham%20University%20Real%20Estate%20Institute,link,extracted_new_stuyvesant_opportunities.json,NO
Salesforce Resume Review and Speed Networking Sessions,https://forms.gle/TB7Kjd7XD4MbfDyi9,link,extracted_new_stuyvesant_opportunities.json,NO
Endless Frontiers Lab Youth Ambassador Program,https://endlessfrontierlabs.com/,link,extracted_new_stuyvesant_opportunities.json,NO
World Series of Innovation Entrepreneurial Challenge,https://www.google.com/search?q=World%20Series%20of%20Innovation%20Entrepreneurial%20Challenge,link,extracted_new_stuyvesant_opportunities.json,NO
VISIONS’ Intergenerational Program Volunteer Service,https://docs.google.com/forms/d/e/1FAIpQLSfcfehk1qzxV82-,link,extracted_new_stuyvesant_opportunities.json,NO
Volunteer for MoMath 2024 NYC Math Festival,https://momath.org/mathfestival/,link,extracted_new_stuyvesant_opportunities.json,NO
Camp Invention Leadership Intern Program,https://www.invent.org/programs/leadership-intern,link,extracted_new_stuyvesant_opportunities.json,NO
Help For Autistic and Disabled Children,https://forms.gle/RNb5jjFTumhNd7vK8,link,extracted_new_stuyvesant_opportunities.json,NO
Visiting Neighbors Volunteer Program,https://www.visitingneighbors.org/volunteer/get-involved,link,extracted_new_stuyvesant_opportunities.json,NO
New Group Theater: College Writing,https://thenewgroup.org/my-story/,link,extracted_new_stuyvesant_opportunities.json,NO
Chinatown Youth Initiatives Summer Leadership Institute,https://www.cyinyc.org/sli,link,extracted_new_stuyvesant_opportunities.json,NO
The Garibaldi-Meucci Museum Summer Art Classes,https://www.garibaldimeuccimuseum.com/product-page/summer-art-classes-,link,extracted_new_stuyvesant_opportunities.json,NO
AI Programming Bootcamps & Research Project Mentorship,https://www.scifair.tech/highschool,link,extracted_new_stuyvesant_opportunities.json,NO
Science and Engineering Apprenticeship Program (SEAP),https://www.navalsteminterns.us/seap/,link,extracted_new_stuyvesant_opportunities.json,NO
Dates Approaching:,https://tryengineeringinstitute.ieee.org/engineering-camp,link,extracted_new_stuyvesant_opportunities.json,NO
Cyber-AI Investigation Camp,https://www.google.com/search?q=Cyber-AI%20Investigation%20Camp,link,extracted_new_stuyvesant_opportunities.json,NO
High School Terminal Coding Challenge,https://terminal.c1games.com/highschool_2024,link,extracted_new_stuyvesant_opportunities.json,NO
Penguin Coding School Free Trials,https://penguincodingschool.com/free-trial-python-signup,link,extracted_new_stuyvesant_opportunities.json,NO
Summer at SEM: Creative Arts Programs,https://summeratsem.org/creative-arts-programs/,link,extracted_new_stuyvesant_opportunities.json,NO
Ronald V. Dellums Memorial SMART Scholarship,https://www.google.com/search?q=Ronald%20V.%20Dellums%20Memorial%20SMART%20Scholarship,link,extracted_new_stuyvesant_opportunities.json,NO
Event Approaching: Columbia STEM QUEST Free Event,https://www.google.com/search?q=Event%20Approaching%3A%20Columbia%20STEM%20QUEST%20Free%20Event,link,extracted_new_stuyvesant_opportunities.json,NO
Event Approaching:,https://girlswritenow.org/event/june22-lead-special-event/,link,extracted_new_stuyvesant_opportunities.json,NO
"Stonybrook University - Japanese Pop Culture: A Window into Society,",https://www.stonybrook.edu/commcms/summer/,link,extracted_new_stuyvesant_opportunities.json,NO
The Science of Well-Being for Teens Course @ Yale University,https://www.coursera.org/learn/the-science-of-well-being-for-teens,link,extracted_new_stuyvesant_opportunities.json,NO
Wharton Global High School Investment Competition,https://globalyouth.wharton.upenn.edu/investment-competition/about/,link,extracted_new_stuyvesant_opportunities.json,NO
South Street Seaport Museum Volunteering,https://southstreetseaportmuseum.org/volunteer/,link,extracted_new_stuyvesant_opportunities.json,NO
Parsons Summer Academy,https://cpe.newschool.edu/youth-and-pre-college/parsons-summer-academy/,link,extracted_new_stuyvesant_opportunities.json,NO
Discover Your City with Culture Pass,https://www.culturepass.nyc/,link,extracted_new_stuyvesant_opportunities.json,NO
Hudson River Park Science Leadership Program: Fall Term,https://docs.google.com/forms/d/1YE4gNSoHdPlvyho3d8F1ulZ3iuedUWLPNk,link,extracted_new_stuyvesant_opportunities.json,NO
Event Approaching: Columbia STEM QUEST Free Event,https://www.vagelos.columbia.edu/education/academic-programs/educational-,link,extracted_new_stuyvesant_opportunities.json,NO
Clear Direction STEM Mentoring Program,https://docs.google.com/forms/d/e/1FAIpQLSfFZa4VpFUuGDLyThKOTpYWv1hIL0,link,extracted_new_stuyvesant_opportunities.json,NO
Congressional App Challenge 2025,https://www.congressionalappchallenge.us/students/student-registration/,link,extracted_new_stuyvesant_opportunities.json,NO
Youth Space Organization:,https://docs.google.com/document/d/18o2t8qHQL_QFEmgfLRCnOQERt_AeL5AAp84I5v,link,extracted_new_stuyvesant_opportunities.json,NO
Capital One Coders Program,https://docs.google.com/forms/d/e/1FAIpQLSd9Bv6b-KNrWnMatzQ-,link,extracted_new_stuyvesant_opportunities.json,NO
Program Dates Approaching:,https://precollege.sps.columbia.edu/columbia-scholastic-press-association/cspa-,link,extracted_new_stuyvesant_opportunities.json,NO
Youth Onstage!,https://allstars.org/our-work/#programs,link,extracted_new_stuyvesant_opportunities.json,NO
Suffolk University Filmmaking Summer Program,https://www.suffolk.edu/cas/degrees-programs/communication-journalism-and-,link,extracted_new_stuyvesant_opportunities.json,NO
Gotham Writers' I'm Obsessed Contest,https://v2.writingclasses.com/contests/im-obsessed,link,extracted_new_stuyvesant_opportunities.json,NO
Luna Hackathon,https://luna.hackclub.com/,link,extracted_new_stuyvesant_opportunities.json,NO
Macaulay Honors College Events,https://macaulay.cuny.edu/event-category/admissions-events/,link,extracted_new_stuyvesant_opportunities.json,NO
Virtual NACAC National College Fairs,https://www.nacacattend.org/fairs#w_32999062_tab_2,link,extracted_new_stuyvesant_opportunities.json,NO
Open House New York (OHNY) Weekend,https://ohny.org/weekend/,link,extracted_new_stuyvesant_opportunities.json,NO
Harvard Undergraduate Women in Business Oriented Leadership,https://www.wib-bold.com/home,link,extracted_new_stuyvesant_opportunities.json,NO
Young Founders Lab Startup Bootcamp,https://www.google.com/search?q=Young%20Founders%20Lab%20Startup%20Bootcamp,link,extracted_new_stuyvesant_opportunities.json,NO
Robert Zur Company Fashion Internship,https://intern.robertzur.com/,link,extracted_new_stuyvesant_opportunities.json,NO
St. Jude Leadership Volunteer Opportunity,https://www.stjude.org/get-involved/school-fundraising-ideas/high-,link,extracted_new_stuyvesant_opportunities.json,NO
Events Approaching : CACNY Senior Series Program,https://www.google.com/search?q=Events%20Approaching%20%3A%20CACNY%20Senior%20Series%20Program,link,extracted_new_stuyvesant_opportunities.json,NO
TurnUp Civic and Activism Remote Internship:,https://drive.google.com/file/d/1drPzuDGqyqR-w3-fKDqIIdykDXkB0dPh/view,link,extracted_new_stuyvesant_opportunities.json,NO
The Bronfman International Fellowship,https://bronfman.org/become-a-fellow/,link,extracted_new_stuyvesant_opportunities.json,NO
Librarians of Tomorrow Internship at the Brooklyn Public Library,https://www.bklynlibrary.org/lot,link,extracted_new_stuyvesant_opportunities.json,NO
AMIGOS Summer Study Abroad Service Project Program,https://amigosinternational.org/summer-programs/,link,extracted_new_stuyvesant_opportunities.json,NO
Yale Splash Program,https://yale.learningu.org/learn/splash.html,link,extracted_new_stuyvesant_opportunities.json,NO
Deadline Approaching: Swiss Institute Paid Teen Programs,https://www.swissinstitute.net/education/teen-programs/,link,extracted_new_stuyvesant_opportunities.json,NO
The Metropolitan Museum of Art (MET) Internship,https://www.metmuseum.org/about-the-met/internships/high-school/school-,link,extracted_new_stuyvesant_opportunities.json,NO
Museum of Moving Image Teen Council 2024-25 Internship,https://movingimage.org/education/teen-council/,link,extracted_new_stuyvesant_opportunities.json,NO
The James Alan Cox Foundation for Student Photojournalists Award,https://www.jamesalancoxfoundation.org/apply/,link,extracted_new_stuyvesant_opportunities.json,NO
Conrad Challenge,https://conradchallenge.awardsplatform.com/,link,extracted_new_stuyvesant_opportunities.json,NO
Deadline Approaching:,https://www.google.com/search?q=Deadline%20Approaching%3A,link,extracted_new_stuyvesant_opportunities.json,NO
Vet Up! Champions: The National HCOP Academy for Veterinary,https://vet.purdue.edu/diversity/vetup/champions.php,link,extracted_new_stuyvesant_opportunities.json,NO
Local Letters for Global Change: A Pulitzer Center Writing Contest,https://pulitzercenter.org/builder/lesson/local-letters-global-change-pulitzer-,link,extracted_new_stuyvesant_opportunities.json,NO
Sarah Lawrence College: Writing Courses,https://www.sarahlawrence.edu/writing-institute/courses/,link,extracted_new_stuyvesant_opportunities.json,NO
Local Letters for Global Change: A Pulitzer Center Writing Contest,https://pulitzercenter.org/builder/lesson/local-letters-global-change-,link,extracted_new_stuyvesant_opportunities.json,NO
Elk National Foundation Most Valuable Student Scholarship,https://www.elks.org/scholars/scholarships/mvs.cfm,link,extracted_new_stuyvesant_opportunities.json,NO
Event Approaching: NYC STEM College Fair,https://www.eventbrite.com/e/free-nysci-stem-college-fair-tickets-,link,extracted_new_stuyvesant_opportunities.json,NO
Event Approaching:,https://www.bklynlibrary.org/calendar/craftivism-teen-crafts-kings-bay-,link,extracted_new_stuyvesant_opportunities.json,NO
NYU/Tandon Cybersecurity Games & Conference Event (CSAW’24),https://www.csaw.io/,link,extracted_new_stuyvesant_opportunities.json,NO
YouthAsk Youth Census Survey,https://www.amplifyapp.org/en/surveys,link,extracted_new_stuyvesant_opportunities.json,NO
Splash Learning Days,https://docs.google.com/document/d/1ulZUDkDeawKaEWVal0FK-OvVCwZDwNSy/edit,link,extracted_new_stuyvesant_opportunities.json,NO
NYU SPS Career Pathways Bridge Program,https://www.sps.nyu.edu/homepage/academics/career-pathways-bridge-,link,extracted_new_stuyvesant_opportunities.json,NO
St. John’s Bread and Life,https://www.volgistics.com/appform/1620022426,link,extracted_new_stuyvesant_opportunities.json,NO
First Event Today:,https://forms.office.com/pages/responsepage.aspx?id=KbgsP7rYBEWJXcpHqvTAX,link,extracted_new_stuyvesant_opportunities.json,NO
Thrive Scholars Programs,https://apply.thrivescholars.org/how-to-apply,link,extracted_new_stuyvesant_opportunities.json,NO
Student Wellness Advocates,https://growingupnyc.cityofnewyork.us/generationnyc/ylc-application/,link,extracted_new_stuyvesant_opportunities.json,NO
Council on International Exchange (CIEE) Study Abroad Programs Early,https://www.ciee.org/go-abroad/high-school-study-abroad/summer/early-birds-,link,extracted_new_stuyvesant_opportunities.json,NO
United States Senate Youth Program,https://ussenateyouth.org/,link,extracted_new_stuyvesant_opportunities.json,NO
Congress Bundestag Youth Exchange Program (CBYX),https://usagermanyscholarship.org/apply/?state=New%20York,link,extracted_new_stuyvesant_opportunities.json,NO
TurnUp Civic Tech Challenge,https://www.turnup.us/turnup-tech,link,extracted_new_stuyvesant_opportunities.json,NO
Expanding the Walls Photography Program,https://www.studiomuseum.org/expandingthewallsapply,link,extracted_new_stuyvesant_opportunities.json,NO
Ace Mentor Engineering Program,https://app.acementor.org/login,link,extracted_new_stuyvesant_opportunities.json,NO
Modeling the Future Challenge,https://www.mtfchallenge.org/,link,extracted_new_stuyvesant_opportunities.json,NO
Make School Tutorials,https://makeschool.org/mediabook/,link,extracted_new_stuyvesant_opportunities.json,NO
Hispanic Heritage Foundation Youth Awards Scholarship,https://hhfawards.hispanicheritage.org/2024/forms/welcome.php,link,extracted_new_stuyvesant_opportunities.json,NO
Science Ambassador Scholarship,https://www.scienceambassadorscholarship.org/,link,extracted_new_stuyvesant_opportunities.json,NO
An Exploration of Algebraic Operations,https://momath.org/most/plus/,link,extracted_new_stuyvesant_opportunities.json,NO
Event Approaching: Queens Borough Hall College Fair,https://drive.google.com/file/d/1C1EhxJt_oJ3NryftivDFndCVWG47-KPc/view?usp=sharing,link,extracted_new_stuyvesant_opportunities.json,NO
Mentoring In Medicine (MIM) Virtual Biomedical Hackathon,https://mimhub.knkit.sg/event/biomedical-research-hackathon-3/register?mc_cid=0ff10b3623,link,extracted_new_stuyvesant_opportunities.json,NO
First Event Approaching Museum of Finance Academy,https://www.moaf.org/education/museum-finance-academy,link,extracted_new_stuyvesant_opportunities.json,NO
Program Start Date Approaching:,https://drive.google.com/file/d/1df7wEKOSTujUiNouS-,link,extracted_new_stuyvesant_opportunities.json,NO
First Event Approaching: What Is Next (WIN) Career Development Series,https://www.whatisnext.academy/cohorts,link,extracted_new_stuyvesant_opportunities.json,NO
Emma Bowen Foundation Internship (EBF) for Seniors,https://www.emmabowenfoundation.org/,link,extracted_new_stuyvesant_opportunities.json,NO
Deadline Approaching:,https://form.jotform.com/242609412757157,link,extracted_new_stuyvesant_opportunities.json,NO
STEMpathize Volunteer Internship Opportunity,https://tinyurl.com/stempathizeinternship,link,extracted_new_stuyvesant_opportunities.json,NO
Event Approaching: Virtual College Fair,https://explorewithuprooted.vfairs.com/en/,link,extracted_new_stuyvesant_opportunities.json,NO
ArtsConnection Student Art Program (SAP) Contest,https://www.google.com/search?q=ArtsConnection%20Student%20Art%20Program%20(SAP)%20Contest,link,extracted_new_stuyvesant_opportunities.json,NO
New York Public Library National Teen Art Contest: Freedom to Read,https://www.nypl.org/spotlight/freedom-to-read/teen-contest,link,extracted_new_stuyvesant_opportunities.json,NO
Code to Cure: AI and the Future of Health Instructional Video Event,https://www.worldsciencefestival.com/programs/code-to-cure-ai-and-the-future-of-,link,extracted_new_stuyvesant_opportunities.json,NO
The Maysles Documentary Center Teen DocMakers Program,https://www.maysles.org/teen-doc-makers-lab,link,extracted_new_stuyvesant_opportunities.json,NO
The Bell Newsroom Internship,https://www.bellvoices.org/apply?ss_source=sscampaigns,link,extracted_new_stuyvesant_opportunities.json,NO
The Lucille Lortel Theater High School Playwriting Fellowship,https://lortel.org/hspf/,link,extracted_new_stuyvesant_opportunities.json,NO
Virginia B. Ball Creative Writing Scholarship Competition,https://www.interlochen.org/creative-writing/academy/virginia-b-ball-creative-,link,extracted_new_stuyvesant_opportunities.json,NO
Kenyon Review Patricia Grodd Poetry Prize for Young Writers,http://www.kenyonreview.org/contests/patricia-grodd/,link,extracted_new_stuyvesant_opportunities.json,NO
ArtsConnection Student Art Program (SAP) Contest,https://airtable.com/appQuqObez96NaMtU/shr3xYXKbVT6V5C08?mc_cid=32c4113164&mc_eid=,link,extracted_new_stuyvesant_opportunities.json,NO
The Elevate Mental Health Awareness Scholarship,https://bold.org/scholarships/elevate-mental-health-awareness-,link,extracted_new_stuyvesant_opportunities.json,NO
The Herblock Award For Editorial Cartoons,https://www.artandwriting.org/scholarships/the-herblock-award-for-editorial-,link,extracted_new_stuyvesant_opportunities.json,NO
Event Approaching: Chat with a Scientist: Defining Inclusion in STEM,https://www.nyas.org/shaping-science/events/inclusion-in-stem/,link,extracted_new_stuyvesant_opportunities.json,NO
Event Approaching: MoMath ‘Ask a Mathmatician’,https://momath.org/ask-anything/,link,extracted_new_stuyvesant_opportunities.json,NO
Deadline Approaching: NYU Weekend Workshops,https://www.sps.nyu.edu/high-school-academy/programs/weekend-,link,extracted_new_stuyvesant_opportunities.json,NO
Community Swap Volunteer Event,https://www.popupswapx.com/events/nycopenstreetsoct2023,link,extracted_new_stuyvesant_opportunities.json,NO
Friendship Circle Volunteering Opportunities,https://www.friendshipcirclenyc.org/teen-volunteer-opportunities,link,extracted_new_stuyvesant_opportunities.json,NO
Stuyvesant Alumni Mentoring Program,https://www.stuyalumni.org/mentorstudents/,link,extracted_new_stuyvesant_opportunities.json,NO
Columbia Writing Academy: Writing for College Success,https://precollege.sps.columbia.edu/programs/academic-year/columbia-writing-academy-,link,extracted_new_stuyvesant_opportunities.json,NO
Latinas On the Verge of Excellence (L.O.V.E.) Mentoring Program,https://www.lovementoring.org/programs-school-base,link,extracted_new_stuyvesant_opportunities.json,NO
Angelo Del Toro Puerto Rican/Hispanic Youth Leadership Institute,https://sites.google.com/schools.nyc.gov/prhyli-nyc-delegation-public/home,link,extracted_new_stuyvesant_opportunities.json,NO
Bill of Rights Institute (BRI) Student Fellowship,https://billofrightsinstitute.org/student-fellowship,link,extracted_new_stuyvesant_opportunities.json,NO
Kennedy-Lugar Youth Exchange and Study (YES) Abroad Program,https://www.yes-abroad.org/about/about-us,link,extracted_new_stuyvesant_opportunities.json,NO
Angelo Del Toro Puerto Rican Hispanic Youth Leadership Program,https://prhyli.org/prhyli-application-delegations/,link,extracted_new_stuyvesant_opportunities.json,NO
TeenLife LIVE Performing & Visual Arts Virtual Fair,https://www.teenlife.com/event-registration/teenlife-live-performing-visual-arts-virtual-fair-,link,extracted_new_stuyvesant_opportunities.json,NO
GuggTeens Sundays and Tuesdays @ the Guggenheim Museum,https://www.guggenheim.org/event/guggteens-sketching-sessions,link,extracted_new_stuyvesant_opportunities.json,NO
Arts Connection Teen Reviewers and Critics Program (TRaC),https://www.google.com/search?q=Arts%20Connection%20Teen%20Reviewers%20and%20Critics%20Program%20(TRaC),link,extracted_new_stuyvesant_opportunities.json,NO
Arts Connection Art-Making Program,https://www.google.com/search?q=Arts%20Connection%20Art-Making%20Program,link,extracted_new_stuyvesant_opportunities.json,NO
Brooklyn Botanic Garden Apprentice Program (GAP),https://www.bbg.org/learn/gap,link,extracted_new_stuyvesant_opportunities.json,NO
Cooper Union STEM Saturdays Inventor Lab Classes,https://cooper.edu/engineering/stem/saturdays,link,extracted_new_stuyvesant_opportunities.json,NO
International Young Researchers Conference STEM Winter Program,https://www.the-iyrc.org/iyrcwinter.html,link,extracted_new_stuyvesant_opportunities.json,NO
Museum of Mathematics Expansions Gifted Math Classes,https://momath.org/expansions/,link,extracted_new_stuyvesant_opportunities.json,NO
Walt Whitman Library Robotics Club @ Bklyn. Public Library,https://www.google.com/search?q=Walt%20Whitman%20Library%20Robotics%20Club%20%40%20Bklyn.%20Public%20Library,link,extracted_new_stuyvesant_opportunities.json,NO
Deadline Approaching:,https://girlswritenow.org/barbie-and-girls-write-now-the-inspiring-women-writing-contest/,link,extracted_new_stuyvesant_opportunities.json,NO
Princeton University's Leonard L. Milberg ’53 High School Poetry Prize,https://arts.princeton.edu/about/opportunities/high-school-contests/poetry-contest/,link,extracted_new_stuyvesant_opportunities.json,NO
The Scholastic Art & Writing Awards Program,https://www.artandwriting.org/awards/,link,extracted_new_stuyvesant_opportunities.json,NO
Event Approaching: Girls Write Now Introduction to Pantoum Poems,https://girlswritenow.org/event/oct26-specialevent/,link,extracted_new_stuyvesant_opportunities.json,NO
Event Approaching: Technica Hackathon 2024,https://gotechnica.org/,link,extracted_new_stuyvesant_opportunities.json,NO
Event Approaching:,https://girlswritenow.org/event/oct28-specialevent/,link,extracted_new_stuyvesant_opportunities.json,NO
The STEM Institute @ City College,https://steminstitutenyc.org/college-now/,link,extracted_new_stuyvesant_opportunities.json,NO
Invest in Girls Online Programs,https://www.investingirls.org/for-students/,link,extracted_new_stuyvesant_opportunities.json,NO
NYC Reading Partners Volunteers,https://readingpartners.org/volunteer-in-new-york/,link,extracted_new_stuyvesant_opportunities.json,NO
SEO Scholars Program,https://sites.google.com/view/seoscholarsrecruitment/faqs?authuser=0#h.aktcbps50bea,link,extracted_new_stuyvesant_opportunities.json,NO
Event Approaching: Saturday Sketching at The Met Fifth Avenue,https://www.metmuseum.org/events/programs/met-creates/saturday-sketching,link,extracted_new_stuyvesant_opportunities.json,NO
"Harvey Mudd College Women’s Inclusion in Science, Technology,",https://www.hmc.edu/admission/wistem/,link,extracted_new_stuyvesant_opportunities.json,NO
Perry Outreach Program (POP) Event,https://perryinitiative.org/event/perry-outreach-program-new-york-ny-3/,link,extracted_new_stuyvesant_opportunities.json,NO
Sophie Davis Health Professions Recruitment and Exposure Program,https://www.google.com/search?q=Sophie%20Davis%20Health%20Professions%20Recruitment%20and%20Exposure%20Program,link,extracted_new_stuyvesant_opportunities.json,NO
Kemper Human Rights Education Foundation (KHREF) Essay Contest,https://khref.org/about/,link,extracted_new_stuyvesant_opportunities.json,NO
YWIB-Metro New York & Columbia University: Inside Engineering,https://community.womeninbio.org/event/newyorkywib92624,link,extracted_new_stuyvesant_opportunities.json,NO
"""New: Youth Communication Immigrant Youth Webinar""","https://us02web.zoom.us/meeting/register/kUTNwDtxTHSjTbxsWmsUEA#/registration""",link,extracted_stuyvesant_opportunities.json,NO
"""New: NYPL College Acceptance Letters and Paying for College Session""","https://www.eventbrite.com/e/32nd-annual-latino-college-expo-leadership-""",link,extracted_stuyvesant_opportunities.json,NO
"""New: Vanderbilt Programs for Talented Youth Summer""","https://academies.hsa.net/pages/virtual""",link,extracted_stuyvesant_opportunities.json,NO
"""New: Stuyvesant Business Clubs Meeting""","https://www.nycservice.org/youth-action-month""",link,extracted_stuyvesant_opportunities.json,NO
"""New: NYPL College Acceptance Letters and Paying for College Session""","https://drive.google.com/file/d/1Hhq167D599BqAvsC1j-""",link,extracted_stuyvesant_opportunities.json,NO
"""New: Deadline Approaching:""","https://www.newrootsinstitute.org/leadership-program/learn-more-apply""",link,extracted_stuyvesant_opportunities.json,NO
"""New: Women in Law Career Information Event @ the NY State Supreme Court""","https://www.nywba.org/events/women-in-law-program/1741210200/""",link,extracted_stuyvesant_opportunities.json,NO
"""New: NYC Students Demand Action March Meeting""","https://forms.everytown.org/a/nycsda-march-meeting""",link,extracted_stuyvesant_opportunities.json,NO
"""New: Justin Brannan Comptroller Campaign Internship""","http://docs.google.com/forms/d/e/1FAIpQLScGsny63IyZI1wNcZ3r5krAgGKNj-""",link,extracted_stuyvesant_opportunities.json,NO
"""New: The Project Lotus Youth Team""","https://growingupnyc.cityofnewyork.us/generationnyc/ylc-application/""",link,extracted_stuyvesant_opportunities.json,NO
"""New: Brooklyn Museum Teen Gallery/Studio Program""","https://www.brooklynmuseum.org/education/art_classes/teen""",link,extracted_stuyvesant_opportunities.json,NO
"""New: Museum of Arts and Design (MAD) Artslife Internship""","https://www.teenlife.com/guide-to-performing-visual-arts-colleges/""",link,extracted_stuyvesant_opportunities.json,NO
"""New: Environmental Studies Summer Youth Institute (ESSYI)""","https://usasciencefestival.org/xsaa/""",link,extracted_stuyvesant_opportunities.json,NO
"""New: All Star Code 2025 Summer Intensive""","https://momath.org/jobs/#student_integrators""",link,extracted_stuyvesant_opportunities.json,NO
"""New: CDC Museum Public Health Academy Online Summer Course""","https://www.cdc.gov/museum/education/online-learning/""",link,extracted_stuyvesant_opportunities.json,NO
