title,url,field,source_file,possibly_broken
California MESA Schools Program,https://mesa.ucop.edu/,url,accelerated-expansion-batch.json,NO
Texas Science Talent Search,https://www.txsts.org/,url,accelerated-expansion-batch.json,NO
New York State Science Congress,https://www.stanys.org/,url,accelerated-expansion-batch.json,NO
Florida Junior Science and Humanities Symposium,https://www.floridaacademyofsciences.org/,url,accelerated-expansion-batch.json,NO
Institute of Electrical and Electronics Engineers (IEEE) Student Competitions,https://www.ieee.org/membership/students/competitions/index.html,url,accelerated-expansion-batch.json,NO
American Institute of Chemical Engineers (AIChE) Student Competitions,https://www.aiche.org/students/awards-scholarships-competitions,url,accelerated-expansion-batch.json,NO
American Society of Mechanical Engineers (ASME) Student Competitions,https://www.asme.org/students/competitions,url,accelerated-expansion-batch.json,NO
Microsoft Scholarship Program,https://careers.microsoft.com/students/us/en/ur-scholarships,url,accelerated-expansion-batch.json,NO
Amazon Future Engineer Scholarship,https://www.amazonfutureengineer.com/scholarships,url,accelerated-expansion-batch.json,NO
Adobe Digital Academy Scholarships,https://www.adobe.com/careers/university/digital-academy.html,url,accelerated-expansion-batch.json,NO
National Medical Fellowships (NMF) Scholarships,https://nmfonline.org/,url,accelerated-expansion-batch.json,NO
American Dental Association (ADA) Foundation Scholarships,https://www.adafoundation.org/en/how-we-help/scholarships,url,accelerated-expansion-batch.json,NO
National Art Education Association Scholarships,https://www.arteducators.org/learn-tools/awards-grants,url,accelerated-expansion-batch.json,NO
Screenwriters Federation of America Scholarships,https://www.screenwritersfederation.org/,url,accelerated-expansion-batch.json,NO
Fulbright U.S. Student Program,https://us.fulbrightonline.org/,url,accelerated-expansion-batch.json,NO
Rhodes Scholarship,https://www.rhodeshouse.ox.ac.uk/scholarships/the-rhodes-scholarship/,url,accelerated-expansion-batch.json,NO
AmeriCorps VISTA Program,https://americorps.gov/serve/americorps-vista,url,accelerated-expansion-batch.json,NO
Peace Corps Volunteer Program,https://www.peacecorps.gov/,url,accelerated-expansion-batch.json,NO
National Association of Realtors Scholarships,https://www.nar.realtor/education-and-events/scholarships,url,accelerated-expansion-batch.json,NO
National Restaurant Association Educational Foundation Scholarships,https://restaurant.org/nraef/scholarships/,url,accelerated-expansion-batch.json,NO
Penn State Business Opportunities Summer Session (BOSS),https://pennstatebehrend.psu.edu/school-of-business/outreach/boss,url,complete-pdf-opportunities.json,NO
University of Texas at Austin McCombs School of Business Programs,https://www.mccombs.utexas.edu/undergraduate/prospective-students/outreach,url,complete-pdf-opportunities.json,NO
Indiana University MEET Kelly,https://kelley.iu.edu/programs/undergraduate/diversity-inclusion/meet-kelley/,url,complete-pdf-opportunities.json,NO
TCU Supply Chain Business Technology Camp,https://neeley.tcu.edu/academic-departments/supply-and-value-chain-management/,url,complete-pdf-opportunities.json,NO
Bank of America Student Leaders,https://about.bankofamerica.com/en/making-an-impact/student-leaders,url,complete-pdf-opportunities.json,NO
Indiana University Women's Leadership Institute,https://kelley.iu.edu/programs/undergraduate/diversity-inclusion/womens-leadership/,url,complete-pdf-opportunities.json,NO
Girls Who Code Summer Immersion Program,https://girlswhocode.com/programs/summer-immersion-program,url,complete-pdf-opportunities.json,NO
NYU Cyber Security Program,https://engineering.nyu.edu/academics/programs/k12-stem-education/summer-programs,url,complete-pdf-opportunities.json,NO
Meta Summer Academy,https://about.fb.com/news/2022/06/expanding-computer-science-education-programs/,url,complete-pdf-opportunities.json,NO
Carnegie Mellon University AI Scholars,https://www.cs.cmu.edu/academics/outreach,url,complete-pdf-opportunities.json,NO
Carnegie Mellon University Experience Designing Games,https://www.etc.cmu.edu/academics/outreach/,url,complete-pdf-opportunities.json,NO
Stanford Center for AI in Medicine and Imaging Research Internship,https://aimi.stanford.edu/education-and-training,url,complete-pdf-opportunities.json,NO
SMASH Academy,https://smash.org/students/smash-academy/,url,complete-pdf-opportunities.json,NO
Oak Ridge National Laboratory NextGen Pathway to Computing,https://www.ornl.gov/content/next-generation-stem-internship-program,url,complete-pdf-opportunities.json,NO
Sandia National Laboratories High School Internship,https://www.sandia.gov/careers/students-and-postdocs/internships/,url,complete-pdf-opportunities.json,NO
Quest Student Research Institute,https://www.questforresearch.org/,url,complete-pdf-opportunities.json,NO
Berkeley Climate Ambassadors,https://nature.berkeley.edu/academics/outreach,url,complete-pdf-opportunities.json,NO
Tuskegee University Forestry and Natural Resources Summer Program,https://www.tuskegee.edu/academics/colleges/caens/academic-departments/agricultural-and-environmental-sciences,url,complete-pdf-opportunities.json,NO
Tuskegee University AgDiscovery Program,https://www.tuskegee.edu/academics/colleges/caens,url,complete-pdf-opportunities.json,NO
North Carolina School of Science and Mathematics Summer Ventures,https://www.ncssm.edu/summer-ventures,url,complete-pdf-opportunities.json,NO
EarthWatch Girls in Science,https://earthwatch.org/education/student-programs,url,complete-pdf-opportunities.json,NO
Student Conservation Association National Conservation Crews,https://www.thesca.org/serve/programs/high-school-programs,url,complete-pdf-opportunities.json,NO
Washington University in St. Louis Olin Fleischer Scholars Program,https://admissions.wustl.edu/diversity/high-school-programs/,url,complete-pdf-opportunities.json,NO
Pomona College Academy for Youth Success,https://www.pomona.edu/admissions/diversity-outreach/academy-youth-success,url,complete-pdf-opportunities.json,NO
University of New Hampshire Upward Bound Program,https://www.unh.edu/inclusive-excellence/upward-bound,url,complete-pdf-opportunities.json,NO
Husson's Early College Access Program,https://www.husson.edu/academics/pre-college/early-college-access,url,complete-pdf-opportunities.json,NO
USC Bovard Scholars,https://admission.usc.edu/diversity/bovard-scholars/,url,complete-pdf-opportunities.json,NO
Drexel's College Access Academy,https://drexel.edu/undergrad/apply/early-outreach/college-access-academy/,url,complete-pdf-opportunities.json,NO
Telluride Association Summer Seminar (TASS),https://www.tellurideassociation.org/our-programs/high-school-students/tas,url,complete-pdf-opportunities.json,NO
Princeton Summer Journalism Program,https://psjp.princeton.edu/,url,complete-pdf-opportunities.json,NO
USC Annenberg Youth Academy for Media and Civic Engagement,https://annenberg.usc.edu/education/youth-academy,url,complete-pdf-opportunities.json,NO
Asian American Journalists Association JCamp,https://www.aaja.org/jcamp,url,complete-pdf-opportunities.json,NO
NYU High School Law Institute,https://www.nyu.edu/students/student-information-and-resources/registration-records-and-graduation/forms-policies-procedures/high-school-programs.html,url,complete-pdf-opportunities.json,NO
University of Notre Dame Leadership Seminars,https://nd.edu/admissions/visit/summer-programs/,url,complete-pdf-opportunities.json,NO
Sadie Nash's Leadership Summer Institute,https://www.sadienash.org/leadership-institute,url,complete-pdf-opportunities.json,NO
North Carolina School of Science and Mathematics Teamship,https://www.ncssm.edu/teamship,url,complete-pdf-opportunities.json,NO
Chicano Latino Youth Leadership Project High School Program,https://www.clyp.org/high-school-program,url,complete-pdf-opportunities.json,NO
U.S. Department of Energy's Introductory College Level Experience in Microbiology (iCLEM),https://education.lbl.gov/internships/high-school-programs/,url,complete-pdf-opportunities.json,NO
Indiana University Summer Research Program at the Simon Cancer Center,https://cancer.iu.edu/research-trials/shared-resources/research-training/summer-internship/,url,complete-pdf-opportunities.json,NO
Indiana University Future Scientist Program,https://medicine.iu.edu/departments/biochemistry/education/outreach/future-scientist,url,complete-pdf-opportunities.json,NO
UIUC High School Summer STEMM Research Program,https://grad.illinois.edu/diversity/bridge/summer-research,url,complete-pdf-opportunities.json,NO
Fred Hutch Cancer Center Summer High School Internship Program,https://www.fredhutch.org/en/education-training/undergraduate-students/high-school-programs.html,url,complete-pdf-opportunities.json,NO
Seattle Children's Hospital Research Training,https://www.seattlechildrens.org/research/education-and-training/high-school-programs/,url,complete-pdf-opportunities.json,NO
Mayo Clinic SPARK Research Mentorship Program,https://college.mayo.edu/academics/explore-health-care-careers/diversity-programs/spark/,url,complete-pdf-opportunities.json,NO
OHSU Knight Cancer Institute Ted R. Lilley CURE Program,https://www.ohsu.edu/knight-cancer-institute/ted-r-lilley-cure-program,url,complete-pdf-opportunities.json,NO
Johns Hopkins Internship in Brain Science,https://neuroscience.jhu.edu/education/high-school-internship/,url,complete-pdf-opportunities.json,NO
Stanford Medical Youth Science Program,https://med.stanford.edu/diversity/programs/mysp.html,url,complete-pdf-opportunities.json,NO
Stanford Genomics Research Internship Program,https://med.stanford.edu/genetics/education/high-school-internship.html,url,complete-pdf-opportunities.json,NO
Stanford Institutes of Medicine Summer Research Program,https://med.stanford.edu/diversity/programs/simr.html,url,complete-pdf-opportunities.json,NO
Hutton Junior Fisheries Biology Program,https://fish.uw.edu/students/junior-fisheries-biology-program/,url,complete-pdf-opportunities.json,NO
Roswell Park High School Summer Research Program,https://www.roswellpark.org/education/high-school-programs,url,complete-pdf-opportunities.json,NO
Memorial Sloan Kettering Cancer Center Human Oncology & Pathogenesis Program,https://www.mskcc.org/education-training/high-school-students,url,complete-pdf-opportunities.json,NO
University of Texas MD Anderson Cancer Center High School Summer Program,https://www.mdanderson.org/education-training/schools-programs/graduate-medical-training/high-school-programs.html,url,complete-pdf-opportunities.json,NO
City of Hope Cancer Center Eugene and Ruth Roberts Summer Academy,https://www.cityofhope.org/education/summer-academy,url,complete-pdf-opportunities.json,NO
The Lillehei Heart Institute Summer Research Scholars Program,https://www.med.umn.edu/surgery/divisions/cardiothoracic/education/lillehei-heart-institute,url,complete-pdf-opportunities.json,NO
Maine Medical Institute Summer Research Program,https://www.mmc.org/education-research/medical-education/high-school-programs,url,complete-pdf-opportunities.json,NO
National Institute of Diabetes and Digestive and Kidney Diseases STEP-UP Program,https://www.niddk.nih.gov/research-funding/research-programs/diversity-programs/step-up,url,complete-pdf-opportunities.json,NO
National Institutes of Health High School Summer Internship Program (HS-SIP),https://www.training.nih.gov/programs/hs-sip,url,complete-pdf-opportunities.json,NO
National Institutes of Health Academic Internship Program (AIP),https://www.training.nih.gov/programs/aip,url,complete-pdf-opportunities.json,NO
The Monell Science Apprenticeship Program,https://www.monell.org/education/high-school-apprenticeship,url,complete-pdf-opportunities.json,NO
Stony Brook University Simons Summer Research Program,https://www.stonybrook.edu/simons/,url,complete-pdf-opportunities.json,NO
Bigelow Laboratory for Ocean Sciences Keller Program,https://www.bigelow.org/education/keller-program/,url,complete-pdf-opportunities.json,NO
Science Mentorship Institute Biology/Neuroscience Mentorship (sci-Mi) Program,https://www.sciencementorship.org/,url,complete-pdf-opportunities.json,NO
MDI Biomedical Bootcamp,https://mdibl.org/education/high-school-programs/,url,complete-pdf-opportunities.json,NO
UCSD Research Experience,https://biology.ucsd.edu/undergraduate/programs/research-experience.html,url,complete-pdf-opportunities.json,NO
UCSF Fresno Summer Biomedical Internship Program,https://fresno.ucsf.edu/education/summer-biomedical-internship,url,complete-pdf-opportunities.json,NO
UCSF Summer Researchers in Global Health,https://globalhealthsciences.ucsf.edu/education/summer-researchers-global-health,url,complete-pdf-opportunities.json,NO
Fermi National Laboratory TARGET Program,https://ed.fnal.gov/programs/target/,url,complete-pdf-opportunities.json,NO
Los Alamos National Laboratory High School Summer Internship,https://www.lanl.gov/careers/career-options/student-internships/high-school/,url,complete-pdf-opportunities.json,NO
Science Accelerating Girls' Engagement (SAGE),https://www.sagescholars.org/,url,complete-pdf-opportunities.json,NO
Determined to be a Doctor Someday,https://www.determinedtobedoctor.org/,url,complete-pdf-opportunities.json,NO
University of Michigan Life Sciences Institute Aspirnaut Program,https://lsi.umich.edu/education/k-12-outreach/aspirnaut-program,url,complete-pdf-opportunities.json,NO
University of Arizona KEYS Research Internship,https://keys.arizona.edu/,url,complete-pdf-opportunities.json,NO
SUNY Oneonta Biological Field Station Summer Internship Program,https://oneonta.edu/academics/biofld/education/internships.asp,url,complete-pdf-opportunities.json,NO
National Institute on Drug Abuse Intramural Research Program,https://irp.drugabuse.gov/education-training/,url,complete-pdf-opportunities.json,NO
Massasoit Community College STEM Research Internship,https://www.massasoit.edu/academics/programs-courses/stem-research-internship/,url,complete-pdf-opportunities.json,NO
Broad Institute of MIT and Harvard Summer Scholars Program,https://www.broadinstitute.org/scientific-community/science-education/broad-summer-scholars-program,url,complete-pdf-opportunities.json,NO
Children's Hospital Los Angeles Health Care Career Exploration,https://www.chla.org/students-education/high-school-programs,url,complete-pdf-opportunities.json,NO
MIT Research Science Institute,https://www.cee.org/programs/research-science-institute,url,complete-pdf-opportunities.json,NO
Northwestern University Young Scholars' Program,https://www.northwestern.edu/pre-college/young-scholars/,url,complete-pdf-opportunities.json,NO
Penn Materials Research Science and Engineering Center Summer Science Initiative,https://www.mrsec.upenn.edu/education/summer-science-initiative,url,complete-pdf-opportunities.json,NO
NASA Maine Space Grant Consortium High School Internship,https://msgc.org/students/internships/,url,complete-pdf-opportunities.json,NO
Air Force Research Laboratory (AFRL) Scholars Program,https://www.afrl.af.mil/Careers/Student-Opportunities/,url,complete-pdf-opportunities.json,NO
MIT Lincoln Laboratory Radar Introduction for Student Engineers,https://www.ll.mit.edu/outreach/llrise,url,complete-pdf-opportunities.json,NO
University of Maryland (College Park): MathQuantum Fellowships,https://www.umd.edu/academics/undergraduate-programs/quantum-studies,url,complete-pdf-opportunities.json,NO
Berkeley's QCaMP (Quantum Systems Accelerator),https://qsa.lbl.gov/education/,url,complete-pdf-opportunities.json,NO
The New York Academy of Sciences Program,https://www.nyas.org/programs/global-stem-alliance/,url,complete-pdf-opportunities.json,NO
The Stanford Program for Inspiring the Next Generation of Women in Physics,https://physics.stanford.edu/academics/undergraduate-program/diversity-programs,url,complete-pdf-opportunities.json,NO
Villanova University VESTED Program,https://www1.villanova.edu/university/engineering/outreach/vested.html,url,complete-pdf-opportunities.json,NO
Girls Inc. Eureka! STEM Program,https://girlsinc.org/programs/eureka/,url,complete-pdf-opportunities.json,NO
North Carolina School of Science and Mathematics Step Up to STEM,https://www.ncssm.edu/step-up-to-stem,url,complete-pdf-opportunities.json,NO
University of Washington Engineering Academy,https://www.engr.washington.edu/outreach/k12/engineering-academy,url,complete-pdf-opportunities.json,NO
University of Maine Consider Engineering,https://umaine.edu/eece/consider-engineering/,url,complete-pdf-opportunities.json,NO
MIT MITES Summer Program,https://oeop.mit.edu/programs/mites,url,complete-pdf-opportunities.json,NO
MIT Women's Technology Program,https://oeop.mit.edu/programs/wtp,url,complete-pdf-opportunities.json,NO
MIT Beaver Works Summer Institute,https://beaverworks.ll.mit.edu/CMS/bw/bwsi,url,complete-pdf-opportunities.json,NO
Drexel University ASM International Materials Science Camp,https://drexel.edu/engineering/academics/undergraduate/summer-programs/,url,complete-pdf-opportunities.json,NO
Colorado School of Mines Summer MultiCultural Engineering Training,https://www.mines.edu/diversity-inclusion/summer-multicultural-engineering-training/,url,complete-pdf-opportunities.json,NO
Florida State University Young Scholars Program,https://www.fsu.edu/students/graduate/young-scholars-program.html,url,complete-pdf-opportunities.json,NO
Santa Clara University Summer Engineering Seminar,https://www.scu.edu/engineering/outreach/summer-engineering-seminar/,url,complete-pdf-opportunities.json,NO
North Carolina School of Science and Mathematics INSPIRE,https://www.ncssm.edu/inspire,url,complete-pdf-opportunities.json,NO
Office of Naval Research Science & Engineering Apprentice Program,https://www.nrl.navy.mil/careers/student-opportunities/,url,complete-pdf-opportunities.json,NO
Carnegie Mellon University Summer Academy for Math and Science,https://www.cmu.edu/pre-college/academic-programs/summer-academy.html,url,complete-pdf-opportunities.json,NO
University of New Hampshire HighTech Bound Internship Program,https://www.unh.edu/engineering/academics/pre-college-programs,url,complete-pdf-opportunities.json,NO
NYU Applied Research Innovations in Science and Engineering (ARISE),https://engineering.nyu.edu/k12-stem-education/arise,url,complete-pdf-opportunities.json,NO
Computer Science Summer Certificate Program Live Online,https://www.nextgenbootcamp.com/course/live-online-computer-science-summer-program/,url,complete-pdf-opportunities.json,NO
Introduction to Programming (Udacity),https://www.udacity.com/course/intro-to-programming-nanodegree--nd000,url,complete-pdf-opportunities.json,NO
Code Connects Computer Science + College Prep,https://www.codeconnects.org/,url,complete-pdf-opportunities.json,NO
Emerging Technologies Summer Camp,https://www.nextgenbootcamp.com/course/emerging-tech-summer-program/,url,complete-pdf-opportunities.json,NO
Python Private Tutoring (NextGen Bootcamp),https://www.nextgenbootcamp.com/course/python-private-tutoring/,url,complete-pdf-opportunities.json,NO
Java Private Tutoring (NextGen Bootcamp),https://www.nextgenbootcamp.com/course/java-private-tutoring/,url,complete-pdf-opportunities.json,NO
Python Data Science & ML Program (NYC),https://www.nextgenbootcamp.com/course/data-science-summer-nyc/,url,complete-pdf-opportunities.json,NO
Java Summer Program NYC,https://www.nextgenbootcamp.com/course/java-summer-program-nyc/,url,complete-pdf-opportunities.json,NO
Coding Bootcamp (Columbia Engineering via Trilogy),https://bootcamp.cvn.columbia.edu/coding/,url,complete-pdf-opportunities.json,NO
Java Game Development (iD Tech),https://www.idtech.com/courses/java-coding-and-game-development,url,complete-pdf-opportunities.json,NO
CS Summer Institute (Google x UCLA),https://buildyourfuture.withgoogle.com/programs/computer-science-summer-institute,url,complete-pdf-opportunities.json,NO
Intro to Python & AI (iD Tech at UCLA),https://www.idtech.com/courses/python-and-ai-machine-learning,url,complete-pdf-opportunities.json,NO
Code Creators Camp (Illinois Tech),https://www.iit.edu/academics/pre-college-programs/code-creators,url,complete-pdf-opportunities.json,NO
World Coders Academy (via CourseHorse),https://coursehorse.com/online/classes/tech/programming/coding/world-coders-academy,url,complete-pdf-opportunities.json,NO
Intro to Programming in Python (UMass Amherst),https://www.umass.edu/uww/programs/pre-college/introduction-programming-python,url,complete-pdf-opportunities.json,NO
Intro to Data Science (Stanford Pre-Collegiate),https://spcs.stanford.edu/programs/summer-institutes/data-science,url,complete-pdf-opportunities.json,NO
Java Camp (The Coder School),https://www.thecoderschool.com/summer-coding-camps/,url,complete-pdf-opportunities.json,NO
Learn to Code (Syracuse University),https://precollege.syr.edu/programs-courses/summer-college/credit-bearing/coding-learn-to-code/,url,complete-pdf-opportunities.json,NO
Tufts Coding Academy,https://precollege.tufts.edu/programs/coding-academy,url,complete-pdf-opportunities.json,NO
Penn Arts & Sciences Coding Academy,https://summer.sas.upenn.edu/programs/high-school/academies/coding,url,complete-pdf-opportunities.json,NO
Python Data Science & Machine Learning Program Live Online,https://www.nextgenbootcamp.com/course/python-summer-course-level-1/,url,complete-pdf-opportunities.json,NO
Introduction to Data Science (Wharton School),https://www.wharton.upenn.edu/pre-college/academies/data-science/,url,complete-pdf-opportunities.json,NO
Introduction to Data Science and Visualization (Harvard Pre-College),https://www.summer.harvard.edu/program/data-science-visualization/,url,complete-pdf-opportunities.json,NO
Data Science Summer Lab (UChicago),https://dsi.uchicago.edu/precollege-programs/,url,complete-pdf-opportunities.json,NO
Pre-College Summer Session (CMU),https://admissions.pce.artsci.cmu.edu/precollege,url,complete-pdf-opportunities.json,NO
Berkeley Pre-College Scholars: Foundations of Data Science,https://precollege.berkeley.edu/programs/data-science-foundations/,url,complete-pdf-opportunities.json,NO
Data Sciences Lab (Quinnipiac University),https://www.qu.edu/precollege/datasciences,url,complete-pdf-opportunities.json,NO
Data Analytics for STEM Success (Rice Elite Tech),https://engineering.rice.edu/precollege/data-analytics,url,complete-pdf-opportunities.json,NO
Pathways in Data Science (UChicago Summer Session),https://summer.uchicago.edu/programs/data-science,url,complete-pdf-opportunities.json,NO
Data Exploration & Analysis (Yale Summer Session),https://summer.yale.edu/high-school/programs/data-exploration,url,complete-pdf-opportunities.json,NO
Xla,http://miamioh.edu/admission/high-school/bridges/index.html),applicationUrl,comprehensive-8-file-opportunities.json,NO
"<</Type/Annot/Subtype/Link/F 4/Border[0 0 0]/Rect[108 477.60001 186.14648 492]/A<</Type/Action/S/URI/URI(https://grammymuseum.org/education/grammy-camp/#:~:text=GRAMMY%20Camp%20is%20a%205,the%20eight%20offered%20career%20tracks.)>>>>",https://stamps.umich.edu/pre-college)>>>>,applicationUrl,comprehensive-8-file-opportunities.json,NO
Summer Health Professions Education Program (SHPEP) - Columbia University,https://www.google.com/search?q=Summer%20Health%20Professions%20Education%20Program%20(SHPEP)%20-%20Columbia%20University%20application,applicationUrl,comprehensive-8-file-opportunities.json,NO
Summer Health Professions Education Program (Howard),https://www.google.com/search?q=Summer%20Health%20Professions%20Education%20Program%20(Howard)%20application,applicationUrl,comprehensive-8-file-opportunities.json,NO
Summer Health Professions Education Program (Louisville),https://www.google.com/search?q=Summer%20Health%20Professions%20Education%20Program%20(Louisville)%20application,applicationUrl,comprehensive-8-file-opportunities.json,NO
Summer Health Professions Education Program (Nebraska),https://www.google.com/search?q=Summer%20Health%20Professions%20Education%20Program%20(Nebraska)%20application,applicationUrl,comprehensive-8-file-opportunities.json,NO
Summer Health Professions Education Program (Rutgers),https://www.google.com/search?q=Summer%20Health%20Professions%20Education%20Program%20(Rutgers)%20application,applicationUrl,comprehensive-8-file-opportunities.json,NO
Summer Health Professions Education Program (UCLA & Drew),https://www.google.com/search?q=Summer%20Health%20Professions%20Education%20Program%20(UCLA%20%26%20Drew)%20application,applicationUrl,comprehensive-8-file-opportunities.json,NO
Summer Health Professions Education Program (UT Houston),https://www.google.com/search?q=Summer%20Health%20Professions%20Education%20Program%20(UT%20Houston)%20application,applicationUrl,comprehensive-8-file-opportunities.json,NO
Summer Health Professions Education Program (Washington),https://www.google.com/search?q=Summer%20Health%20Professions%20Education%20Program%20(Washington)%20application,applicationUrl,comprehensive-8-file-opportunities.json,NO
Summer Health Professions Education Program (Western),https://www.google.com/search?q=Summer%20Health%20Professions%20Education%20Program%20(Western)%20application,applicationUrl,comprehensive-8-file-opportunities.json,NO
MD-PhD Undergraduate Summer (MPUS) Fellowship,https://www.google.com/search?q=MD-PhD%20Undergraduate%20Summer%20(MPUS)%20Fellowship%20application,applicationUrl,comprehensive-8-file-opportunities.json,NO
Undergraduate Research for Prospective Physician-Scientists and Physician-Engineers,https://www.google.com/search?q=Undergraduate%20Research%20for%20Prospective%20Physician-Scientists%20and%20Physician-Engineers%20application,applicationUrl,comprehensive-8-file-opportunities.json,NO
