title,url,field,source_file,possibly_broken
One Deadline Approaching:,https://kelley.iu.edu/programs/undergrad/pre-college/ywi.html,link,extracted_new_stuyvesant_opportunities.json,NO
Gilder Lehrman History Internships,https://www.gilderlehrman.org/programs-and-events/internships,link,extracted_new_stuyvesant_opportunities.json,NO
Postsecondary College & Careers Fair Registration,https://docs.google.com/forms/d/e/1FAIpQLSeccRJgsx64AjkiI7Z4nxcErU0PQ3tbIIe2,link,extracted_new_stuyvesant_opportunities.json,NO
Chinatown 360 Youth Wellbeing & Cultural Identity Survey,https://issnyc.org/,link,extracted_new_stuyvesant_opportunities.json,NO
Mayor’s Office Paid Internships,https://a002-oom03.nyc.gov/nycmointernship/index.html,link,extracted_new_stuyvesant_opportunities.json,NO
Harvey Epstein For City Council Volunteer Fellowship,https://docs.google.com/forms/d/e/1FAIpQLSfu8GuWlukBHjgrTZOi-,link,extracted_new_stuyvesant_opportunities.json,NO
Edafe Okporo For City Council Internship,https://www.google.com/search?q=Edafe%20Okporo%20For%20City%20Council%20Internship,link,extracted_new_stuyvesant_opportunities.json,NO
Deadline Approaching: It Starts With the Arts” Art Competition,https://nycaieroundtable.org/blog/third-annual-iswta-art-competition,link,extracted_new_stuyvesant_opportunities.json,NO
The Teen Art Hang at the Jewish Museum,https://www.google.com/search?q=The%20Teen%20Art%20Hang%20at%20the%20Jewish%20Museum,link,extracted_new_stuyvesant_opportunities.json,NO
Brooklyn Bridge Park TIDES Program,https://www.brooklynbridgepark.org/education/teen-programs,link,extracted_new_stuyvesant_opportunities.json,NO
Columbia University Student Group Science Research Symposium,https://www.google.com/search?q=Columbia%20University%20Student%20Group%20Science%20Research%20Symposium,link,extracted_new_stuyvesant_opportunities.json,NO
Pioneer Research Program,https://apply.pioneeracademics.com/portal/apply,link,extracted_new_stuyvesant_opportunities.json,NO
Next Session Approaching:,https://nyexploring.org/b-registar/,link,extracted_new_stuyvesant_opportunities.json,NO
Carnegie Mellon University picoCTF Hacking,https://www.picoctf.org/competitions/2025-spring.html,link,extracted_new_stuyvesant_opportunities.json,NO
Ross Mathematics Program,https://rossprogram.org/,link,extracted_new_stuyvesant_opportunities.json,NO
Princeton University Laboratory Learning Program,https://research.princeton.edu/about-us/internships/laboratory-learning-,link,extracted_new_stuyvesant_opportunities.json,NO
University of Michigan’s Joy of Coding Summer Course,https://joyofcoding.eecs.umich.edu/,link,extracted_new_stuyvesant_opportunities.json,NO
Manhattan/Staten Island Summer Health Internship Program (SHIP),https://msiahec.org/ship/,link,extracted_new_stuyvesant_opportunities.json,NO
Bronx/Westchester Summer Health Internship Program (SHIP),https://bwahec.org/our-programs/highschool/,link,extracted_new_stuyvesant_opportunities.json,NO
Event Approaching:,https://girlswritenow.org/event/march4-careerchat/,link,extracted_new_stuyvesant_opportunities.json,NO
Richard L. Price New York City Public High School Essay Contest,https://drive.google.com/file/d/1IXw3e8cwJ56KyTy2tzk5CX2Q57ONbEF7/view?usp,link,extracted_new_stuyvesant_opportunities.json,NO
2025 Ned Vizzini Teen Writing Contest,https://www.bklynlibrary.org/teen-writing-contest,link,extracted_new_stuyvesant_opportunities.json,NO
Youth Communication Spring Writing Contest,https://youthcomm.org/teen-writing-contest/,link,extracted_new_stuyvesant_opportunities.json,NO
Harvard Library of New York Young Readers Prize,https://www.youngreadersprize.org/,link,extracted_new_stuyvesant_opportunities.json,NO
Congressional Black Caucus Foundation Scholarships,https://www.cbcfinc.org/programs/scholarships/,link,extracted_new_stuyvesant_opportunities.json,NO
The Ultimate Scholarship Spreadsheet Resource,https://www.seedsoffortune.org/post/the-ultimate-scholarship-spreadsheet-,link,extracted_new_stuyvesant_opportunities.json,NO
Event Approaching: Meet the Experts: Unlocking Civic Careers,https://www.google.com/search?q=Event%20Approaching%3A%20Meet%20the%20Experts%3A%20Unlocking%20Civic%20Careers,link,extracted_new_stuyvesant_opportunities.json,NO
Event Approaching: Engineering & Engineering Technology at SUNY,https://engage.suny.edu/register/engineering2025,link,extracted_new_stuyvesant_opportunities.json,NO
StuyHacks Event,https://forms.gle/JGYam1AHhAXvfyff6,link,extracted_new_stuyvesant_opportunities.json,NO
Deadline Approaching: TryEngineering Summer Institute Program,https://tryengineeringinstitute.ieee.org/engineering-summer-camp-registration-,link,extracted_new_stuyvesant_opportunities.json,NO
Summer Careers Exploration Program,https://www.chinaaidsfund.org/our-projects/summer-careers-exploration-,link,extracted_new_stuyvesant_opportunities.json,NO
Deadline Approaching: Personal Finance Video Contest,https://www.google.com/search?q=Deadline%20Approaching%3A%20Personal%20Finance%20Video%20Contest,link,extracted_new_stuyvesant_opportunities.json,NO
Baruch College Stock Market Challenge,https://zicklin.baruch.cuny.edu/faculty-research/centers-institutes/subotnick-,link,extracted_new_stuyvesant_opportunities.json,NO
GenHERation Summer Intensive,https://genheration.com/summer-intensive/,link,extracted_new_stuyvesant_opportunities.json,NO
Questbridge College Prep Scholars Program,https://www.questbridge.org/high-school-students/college-prep-scholars,link,extracted_new_stuyvesant_opportunities.json,NO
Sadie Nash Summer Leadership Institute,http://www.sadienash.org/summer-institute/,link,extracted_new_stuyvesant_opportunities.json,NO
Young Leaders Summit (YLS),https://ylc.hsfts.net/yls-application,link,extracted_new_stuyvesant_opportunities.json,NO
FIRE Free Speech Leadership Summit,https://www.thefire.org/get-involved/be-an-advocate/students/free-speech-leadership-,link,extracted_new_stuyvesant_opportunities.json,NO
Mark Levine Campaign Fellowship,https://www.google.com/search?q=Mark%20Levine%20Campaign%20Fellowship,link,extracted_new_stuyvesant_opportunities.json,NO
Deadline Approaching: Create Real Impact Contest,https://www.createrealimpact.com/#registration,link,extracted_new_stuyvesant_opportunities.json,NO
Port Authority Earth Day Poster Contest,https://www.panynj.gov/bus-terminals/en/port-authority-bus-terminal-advisory-council-,link,extracted_new_stuyvesant_opportunities.json,NO
The Jewish Museum High School Video Workshop,https://thejewishmuseum.org/programs/teens#video-workshop,link,extracted_new_stuyvesant_opportunities.json,NO
The Jewish Museum Teen Intern Program,https://thejewishmuseum.org/programs/teens#teen-internships,link,extracted_new_stuyvesant_opportunities.json,NO
Deadline Approaching: Zero Waste Island Internship,https://earthmatter.org/about-us/team/zero-waste-island-internship/,link,extracted_new_stuyvesant_opportunities.json,NO
Van Cortland Park Green Scholars Internships,https://vancortlandt.org/programs-overview/internships/,link,extracted_new_stuyvesant_opportunities.json,NO
Kode with Klossy,https://www.kodewithklossy.com/camp,link,extracted_new_stuyvesant_opportunities.json,NO
First Deadline Approaching:,https://writetheworld.org/competition-page/5304?utm_medium=email&_hsenc=p2ANqtz--,link,extracted_new_stuyvesant_opportunities.json,NO
Octavia Project Summer Program: Science Fiction/Fantasy Workshops,https://www.octaviaproject.org/join-the-octavia-project-summer-institute/,link,extracted_new_stuyvesant_opportunities.json,NO
Opportunity Music Project,https://www.opportunitymusicproject.org/programs/overview,link,extracted_new_stuyvesant_opportunities.json,NO
Stuyvesant Alumni Association Scholarships,https://stuyalumni.org/2025-scholarships/,link,extracted_new_stuyvesant_opportunities.json,NO
Deadline Approaching: Islamic Scholarship Fund,https://islamicscholarshipfund.org/,link,extracted_new_stuyvesant_opportunities.json,NO
N.L.H.A. Air Cares Scholarship,http://hudnlha.com/education-fund/,link,extracted_new_stuyvesant_opportunities.json,NO
NACAC In-Person College Fair,https://www.nacacattend.org/fairs,link,extracted_new_stuyvesant_opportunities.json,NO
Queens Public Library College Readiness Fair,https://www.eventbrite.com/e/college-readiness-college-fair-tickets-,link,extracted_new_stuyvesant_opportunities.json,NO
College Now Summer Courses @ City College & Hunter College,https://www.cuny.edu/academics/current-initiatives/k16/college-now/,link,extracted_new_stuyvesant_opportunities.json,NO
Alfred University Summer Institutes & Camps,https://www.alfred.edu/about/community/summer-camps/,link,extracted_new_stuyvesant_opportunities.json,NO
The Long Island University Summer Honors Institute,https://www.liu.edu/honors,link,extracted_new_stuyvesant_opportunities.json,NO
AoPS Academy Summer Virtual Campus,https://virtual.aopsacademy.org/#course-offerings,link,extracted_new_stuyvesant_opportunities.json,NO
YEP! NYC Entrepreneurship Incubator –Information Session at Stuy,https://docs.google.com/forms/d/1aJRwUjfhPmOiLa2jADsp02abQt74IjRo32pL,link,extracted_new_stuyvesant_opportunities.json,NO
Rock the Street Wall Street Finance Program,https://drive.google.com/file/d/1DBNLePAOrYxr7QV78FPPBP5ztch21kIm/view?usp,link,extracted_new_stuyvesant_opportunities.json,NO
NYC Parks Kids in Motion City Seasonal Aide,https://www.google.com/search?q=NYC%20Parks%20Kids%20in%20Motion%20City%20Seasonal%20Aide,link,extracted_new_stuyvesant_opportunities.json,NO
1- Seeds of Fortune Girls Start Up Business Accelerator,https://www.seedsoffortune.org/girlsstartup,link,extracted_new_stuyvesant_opportunities.json,NO
2- Seeds of Fortune Business Innovation Research Fellowship,https://www.seedsoffortune.org/innovation,link,extracted_new_stuyvesant_opportunities.json,NO
School of Business @ Stevens Institute of Technology Internships,https://www.stevens.edu/page-basic/finance-and-investing-1-week-intensive-,link,extracted_new_stuyvesant_opportunities.json,NO
Youthbridge New York Fellowship Program,https://www.youthbridgeny.org/fellowship,link,extracted_new_stuyvesant_opportunities.json,NO
Brooklyn District Attorney Summer internship,https://www.google.com/search?q=Brooklyn%20District%20Attorney%20Summer%20internship,link,extracted_new_stuyvesant_opportunities.json,NO
Event Approaching:,https://www.statenislandmuseum.org/event/teen-tour-activity/,link,extracted_new_stuyvesant_opportunities.json,NO
Event Approaching:,https://www.statenislandmuseum.org/event/teen-drawing-workshop/,link,extracted_new_stuyvesant_opportunities.json,NO
Cooper Hewitt Design Career Fair,https://www.google.com/search?q=Cooper%20Hewitt%20Design%20Career%20Fair,link,extracted_new_stuyvesant_opportunities.json,NO
Van Cortlandt Park Garden 2 Market Internship,https://vancortlandt.org/programs-,link,extracted_new_stuyvesant_opportunities.json,NO
Wyckoff Farmhouse Garden Apprentice,https://wyckoffmuseum.org/garden-apprentice-program/,link,extracted_new_stuyvesant_opportunities.json,NO
Riverside Teen Corps Horticulture Internship Program,https://riversideparknyc.org/2025-teen-corps-application/,link,extracted_new_stuyvesant_opportunities.json,NO
Deadline Approaching: One Lab Summer Studio,https://www.onelab.org/apply,link,extracted_new_stuyvesant_opportunities.json,NO
Deadline Approaching:,https://www.bnl.gov/education/programs/program.php?q=219,link,extracted_new_stuyvesant_opportunities.json,NO
First Class Approaching:,https://www.amnh.org/learn-teach/teens/science-alliance-high-school,link,extracted_new_stuyvesant_opportunities.json,NO
Event Approaching:,https://forms.gle/ZwvJ5fgheZz7FvCw8,link,extracted_new_stuyvesant_opportunities.json,NO
Actuarial Science and Programming Summer Camps,https://www.lvc.edu/about/camps-community-programming/computer-data-science-,link,extracted_new_stuyvesant_opportunities.json,NO
Center for Architecture Summer Programs,https://www.centerforarchitecture.org/k-12/youth-family-programs/summer-,link,extracted_new_stuyvesant_opportunities.json,NO
UCLA Global Medical Brigades Science and Medicine Competition,https://www.algoed.co/competitions/ucla-global-medical-brigades-science-medicine-,link,extracted_new_stuyvesant_opportunities.json,NO
DNA Learning Center In-Person Spring Break Day Camps,https://summercamps.dnalc.org/,link,extracted_new_stuyvesant_opportunities.json,NO
Manhattan Medical Immersion Camp,https://manhattanmedicalcadavercamp.com/,link,extracted_new_stuyvesant_opportunities.json,NO
DNA Learning Center In-Person & Virtual Summer Day Camps,https://summercamps.dnalc.org/dnalc-nyc/,link,extracted_new_stuyvesant_opportunities.json,NO
Rosetta Institute of Biomedical Research Workshops,https://www.rosettainstitute.org/,link,extracted_new_stuyvesant_opportunities.json,NO
Deadline Approaching :,https://www.jcu.edu/academics/english/undergraduate/special-,link,extracted_new_stuyvesant_opportunities.json,NO
Hearst High School Media Internship,https://paleycenter.bamboohr.com/careers/168,link,extracted_new_stuyvesant_opportunities.json,NO
Deadline Approaching:,https://www.apollotheater.org/education/technical-internship,link,extracted_new_stuyvesant_opportunities.json,NO
Think for Yourself Essay Contest,https://letgrow.org/program/think-for-yourself-scholarship-2/,link,extracted_new_stuyvesant_opportunities.json,NO
Fighting Words Poetry Contest,https://pulitzercenter.org/builder/lesson/fighting-words-poetry-response-current-events-,link,extracted_new_stuyvesant_opportunities.json,NO
Oyate Group Brandon Hendricks Scholarship,https://www.surveymonkey.com/r/5QL6VZP,link,extracted_new_stuyvesant_opportunities.json,NO
Design Career Fair,https://www.cooperhewitt.org/event/design-career-fair-04-01-2025/,link,extracted_new_stuyvesant_opportunities.json,NO
Event Approaching:,https://momath.org/most/march/#lora,link,extracted_new_stuyvesant_opportunities.json,NO
Cornell Splash Event,https://cornell.learningu.org/,link,extracted_new_stuyvesant_opportunities.json,NO
First Deadline Approaching:,https://www.fordham.edu/summer-session/pre-college-programs/summer-,link,extracted_new_stuyvesant_opportunities.json,NO
The New York Institute of Technology Summer Sessions,https://www.nyit.edu/student_resources/summer_sessions,link,extracted_new_stuyvesant_opportunities.json,NO
Hofstra University PreCollegiate Career Discovery Program,https://www.hofstra.edu/academics/ce/ce_pre_collegiate_classes_long_island_courses.,link,extracted_new_stuyvesant_opportunities.json,NO
University of Massachusetts/Amherst College Prep Workshops,https://www.umass.edu/uww/programs/pre-college/workshops/,link,extracted_new_stuyvesant_opportunities.json,NO
Accounting/Accelerated Career Awareness Program (ACAP),https://nabainc.org/acap/,link,extracted_new_stuyvesant_opportunities.json,NO
Consult for Impact Leadership Development Program,https://airtable.com/app3yp596CDaJxCxq/shrK4vEwj9gn2jpvJ,link,extracted_new_stuyvesant_opportunities.json,NO
Student Election Day Poll Worker Jobs:,https://studentpollworker.vote.nyc/,link,extracted_new_stuyvesant_opportunities.json,NO
Deadline Approaching: Summer Meals Program Paid Apprentice Program,https://www.google.com/search?q=Deadline%20Approaching%3A%20Summer%20Meals%20Program%20Paid%20Apprentice%20Program,link,extracted_new_stuyvesant_opportunities.json,NO
List of Summer Camp Jobs (Day and Sleep-Away Camps),https://docs.google.com/document/d/1LPXAF4sJHcRecDymtwfrEXO8fces7n-,link,extracted_new_stuyvesant_opportunities.json,NO
Foundation for Teaching Economics Programs,https://fte.org/students/economics-for-leaders-program/,link,extracted_new_stuyvesant_opportunities.json,NO
Hudson Lab Ventures Summer Innovation Programs,https://hudsonlabventures.com/programs,link,extracted_new_stuyvesant_opportunities.json,NO
9/11 Museum Volunteers,https://www.911memorial.org/support/volunteer,link,extracted_new_stuyvesant_opportunities.json,NO
DOROT’s Summer Teen Internships,https://www.dorotusa.org/volunteer/high-school-college-internships/summer-,link,extracted_new_stuyvesant_opportunities.json,NO
NYU College Access Leadership Institute,https://www.nyu.edu/admissions/high-school-and-middle-school-,link,extracted_new_stuyvesant_opportunities.json,NO
Futures Forge Skills for Success Program,https://www.futuresforge.org/summer,link,extracted_new_stuyvesant_opportunities.json,NO
American Legion Boys' State Summer Program,https://nylegion.net/boys-state/,link,extracted_new_stuyvesant_opportunities.json,NO
World Historian Student Essay Competition,https://www.thewha.org/wha-awards/world-historian-student-essay-,link,extracted_new_stuyvesant_opportunities.json,NO
Deadline Approaching: Arts Connection Student Art Program (SAP),https://www.google.com/search?q=Deadline%20Approaching%3A%20Arts%20Connection%20Student%20Art%20Program%20(SAP),link,extracted_new_stuyvesant_opportunities.json,NO
Folk Art Youth Art Connection Program,https://folkartmuseum.org/resources/youth-art-connection/,link,extracted_new_stuyvesant_opportunities.json,NO
New York Road Runners Run for the Future Program,https://www.nyrr.org/youth/youth-initiatives/nyrr-run-for-the-future,link,extracted_new_stuyvesant_opportunities.json,NO
CREST/HIRES Summer Internship,https://crest.cuny.edu/hires/apply-now/,link,extracted_new_stuyvesant_opportunities.json,NO
Rose Hulman Institute of Technology Summer STEM Programs,https://www.rose-hulman.edu/admissions-and-aid/early-planning/rose-,link,extracted_new_stuyvesant_opportunities.json,NO
STEM from Dance: Girls Rise Up,https://stemfromdance.org/programs/girls-rise-up,link,extracted_new_stuyvesant_opportunities.json,NO
Deadline Approaching:,https://apply-undergrad.rpi.edu/register/PREFACE2025,link,extracted_new_stuyvesant_opportunities.json,NO
AllStarCode AI Inquiry Workshop,https://www.eventbrite.com/e/all-star-code-2025-weekend-intensive-ai-inquiry-,link,extracted_new_stuyvesant_opportunities.json,NO
Deadline Approaching: Summer Scholar Visiting Program,https://feinstein.northwell.edu/education/summer-student-intern-program,link,extracted_new_stuyvesant_opportunities.json,NO
The Sophie Davis Health Professions Mentorship Program (HPMP),https://medicine.cuny.edu/health-professions-mentorship-program-hpmp/,link,extracted_new_stuyvesant_opportunities.json,NO
Virtual Shadowing Experience,https://www.prehealthshadowing.com/all-sessions/,link,extracted_new_stuyvesant_opportunities.json,NO
Deadline Approaching: Enough! Plays to End Gun Violence,https://www.enoughplays.com/writing,link,extracted_new_stuyvesant_opportunities.json,NO
The Animation Project Animated Storytelling Series,https://events.humanitix.com/tap-animated-storytelling-group,link,extracted_new_stuyvesant_opportunities.json,NO
Deadline Approaching: Wooster Group Summer Institute,https://thewoostergroup.org/summer-institute,link,extracted_new_stuyvesant_opportunities.json,NO
Legacy Project: Listen to a Life Story Contest,https://www.legacyproject.org/7gen/ltalcontest.html,link,extracted_new_stuyvesant_opportunities.json,NO
Teen Art Showcase Video Challenge,http://artimmersionproject.com/teen-art-showcase-challenge,link,extracted_new_stuyvesant_opportunities.json,NO
Girls Write Now Collaboratory Summer Journeys 2025,https://girlswritenow.org/journeys/?_journey_cycles=summer-2025,link,extracted_new_stuyvesant_opportunities.json,NO
Literacy Unbound Summer Writing/Performance Institute,https://cpet.tc.columbia.edu/literacy-unbound-2024-students.html#overview,link,extracted_new_stuyvesant_opportunities.json,NO
Write the World Virtual Summer Writing Camps 2025,https://workshops.writetheworld.org/global-writing/virtual-writing-camp/,link,extracted_new_stuyvesant_opportunities.json,NO
ReelWorks Film Summer Supported Experimental Lab,https://www.reelworks.org/afterschool,link,extracted_new_stuyvesant_opportunities.json,NO
Deadline Approaching: The OK You Challenge,https://okyou.org/ok-challenge-2025/,link,extracted_new_stuyvesant_opportunities.json,NO
Art Studies/Art History Scholarship,https://dedalusfoundation.org/programs/fellowships-awards/view/high-school-,link,extracted_new_stuyvesant_opportunities.json,NO
Event Approaching: Tri-State Engineering Expo,https://www.eventbrite.com/e/2025-tri-state-engineering-expo-students-tickets-,link,extracted_new_stuyvesant_opportunities.json,NO
Prom x QPL: Prom Attire Giveaway Events,https://qlmarketing.typeform.com/to/sxri2dWI,link,extracted_new_stuyvesant_opportunities.json,NO
Princeton Splash On-Campus Mini-Classes,https://princeton.learningu.org/learn.html,link,extracted_new_stuyvesant_opportunities.json,NO
STEP SUMMER Programs: “STEP (Science and Technology Entry Program),https://docs.google.com/document/d/1db9ygMcGpcpfgURBcCEQQV1fBOCp7XG5/edit?usp=shari,link,extracted_new_stuyvesant_opportunities.json,NO
Fordham University STEP Summer Program,https://www.fordham.edu/academics/academic-resources/step/step-summer-,link,extracted_new_stuyvesant_opportunities.json,NO
Columbia's Double Discovery Center Summer Academy,https://ddc.college.columbia.edu/content/eligibility-0,link,extracted_new_stuyvesant_opportunities.json,NO
Deadline Approaching: PricewaterhouseCoopers (PwC) Tour Sign-Up,https://docs.google.com/forms/d/e/1FAIpQLSedX1eFY-,link,extracted_new_stuyvesant_opportunities.json,NO
Paid Kayak Associates with the Brooklyn Bridge Park Conservancy,https://brooklynbridgepark.org/wp-content/uploads/2025/03/2025-Kayak-Associate-Job-,link,extracted_new_stuyvesant_opportunities.json,NO
Apex for Youth Career Exploration Events,https://www.google.com/search?q=Apex%20for%20Youth%20Career%20Exploration%20Events,link,extracted_new_stuyvesant_opportunities.json,NO
Seeds of Fortune Summer Programs Info Sessions,https://us06web.zoom.us/meeting/register/OtFTqIIDTuO2BIRV2HLwUA#/registratio,link,extracted_new_stuyvesant_opportunities.json,NO
Global Kids Internships & Paid Positions,https://globalkids.org/job-intern-nyc/,link,extracted_new_stuyvesant_opportunities.json,NO
Go Getter Summer Internship,https://www.goprojectnyc.org/get-involved/volunteer#GOGetter,link,extracted_new_stuyvesant_opportunities.json,NO
New York Public Library Business Plan Competition,https://www.nypl.org/help/services/startup,link,extracted_new_stuyvesant_opportunities.json,NO
Luna Park Summer Jobs,https://lunaparknyc.com/jobs/,link,extracted_new_stuyvesant_opportunities.json,NO
Whatever It Takes (WIT) Courses,https://www.doingwit.org/classes,link,extracted_new_stuyvesant_opportunities.json,NO
CUNY Explorers Program,https://k16.cuny.edu/explorers/,link,extracted_new_stuyvesant_opportunities.json,NO
Peace Ambassador Leadership Summit (PALS),https://www.nveee.org/pals/,link,extracted_new_stuyvesant_opportunities.json,NO
MoMA Teens Media Lab: Pinhole Photography with Kelli Anderson,https://www.google.com/search?q=MoMA%20Teens%20Media%20Lab%3A%20Pinhole%20Photography%20with%20Kelli%20Anderson,link,extracted_new_stuyvesant_opportunities.json,NO
GuggTeens Fest at the Guggenheim Museum,https://secure.guggenheim.org/events/f00b764b-e08b-d0da-6847-824ac3e41c44,link,extracted_new_stuyvesant_opportunities.json,NO
Arts Connection Teens Curate Teens Artists - Collective Pulse,https://docs.google.com/forms/d/e/1FAIpQLSdHMXi-l8-,link,extracted_new_stuyvesant_opportunities.json,NO
Hudson River Park Volunteer Program,https://www.google.com/search?q=Hudson%20River%20Park%20Volunteer%20Program,link,extracted_new_stuyvesant_opportunities.json,NO
The Summit STEM Fellowship,https://www.summitstemfellowship.org/,link,extracted_new_stuyvesant_opportunities.json,NO
MIT Lincoln Laboratory Cipher Program (LLCipher),https://mit-llc.smapply.io/prog/llcipher_/,link,extracted_new_stuyvesant_opportunities.json,NO
SigmaCamp,https://sigmacamp.org/2025,link,extracted_new_stuyvesant_opportunities.json,NO
Mathily,http://www.mathily.org/,link,extracted_new_stuyvesant_opportunities.json,NO
NYU CREATE Coding for Game Design High School Summer Program,https://steinhardt.nyu.edu/create/high-school-summer-program,link,extracted_new_stuyvesant_opportunities.json,NO
New York Historical Society Tech Scholars: Web Design,https://www.nyhistory.org/education/digital-humanities,link,extracted_new_stuyvesant_opportunities.json,NO
John Jay College Forensic Science Workshop,https://forms.gle/jzkS6gzTRbHQ3zDY6,link,extracted_new_stuyvesant_opportunities.json,NO
Columbia University State Pre-College Enrichment Program (S-PREP),http://www.vagelos.columbia.edu/sprep,link,extracted_new_stuyvesant_opportunities.json,NO
Apex for Youth Healthcare Careers Virtual Panel,https://www.google.com/search?q=Apex%20for%20Youth%20Healthcare%20Careers%20Virtual%20Panel,link,extracted_new_stuyvesant_opportunities.json,NO
Event Approaching: Girls Write Now Career Chat: Demstifying the World,https://girlswritenow.org/event/apr8careerchat/,link,extracted_new_stuyvesant_opportunities.json,NO
YC Teen Annual Summer Writing Workshop,https://youthcomm.org/teens-write-for-us/,link,extracted_new_stuyvesant_opportunities.json,NO
Litchfield Jazz Camp & Scholarship Opportunity,https://litchfieldjazzcamp.com/camp-registration/,link,extracted_new_stuyvesant_opportunities.json,NO
A Voice for Animals Contest,https://www.hennet.org/contest.php,link,extracted_new_stuyvesant_opportunities.json,NO
Spectrum News Challenge TV Show Contestant Application,https://charter.jotform.com/211444483735053,link,extracted_new_stuyvesant_opportunities.json,NO
Deadline Approaching: The Gloria Barron Prize,https://barronprize.org/apply/,link,extracted_new_stuyvesant_opportunities.json,NO
E-waste Scholarship,http://www.digitalresponsibility.org/ewaste-scholarship,link,extracted_new_stuyvesant_opportunities.json,NO
Milton Fisher Scholarship,https://mfscholarship.org/index.html,link,extracted_new_stuyvesant_opportunities.json,NO
Study.com Student Scholarships,https://study.com/resources/student-scholarships#0697,link,extracted_new_stuyvesant_opportunities.json,NO
First Event Approaching NYPL Riverside Library Comic Book Events,https://www.nypl.org/events/calendar?location=62&target%5B%5D=ya,link,extracted_new_stuyvesant_opportunities.json,NO
